{
  "schema": "gkos.admission-policy.request.v1",
  "contract": "gkos.admission-policy.v1",
  "contractVersion": "1.0.0",
  "requestId": "fixture:human-review",
  "idempotencyKey": "fixture:human-review:1",
  "subject": {
    "id": "fixture:artifact:human",
    "type": "derived_summary",
    "contentHash": "sha256:aaaaaaaaaaaaaaaaaaaaaaaaaaaaaaaaaaaaaaaaaaaaaaaaaaaaaaaaaaaaaaaa"
  },
  "policyRef": {
    "id": "fixture:bounded-derived-memory",
    "version": "1.0.0",
    "digest": "sha256:15a839802b373661c54d3a97b268db49291d84e0ac8aa9b42aaeed9eac4b94a4"
  },
  "inputHashes": [
    { "name": "source-packet", "digest": "sha256:bbbbbbbbbbbbbbbbbbbbbbbbbbbbbbbbbbbbbbbbbbbbbbbbbbbbbbbbbbbbbbbb" },
    { "name": "semantic-assessment", "digest": "sha256:cccccccccccccccccccccccccccccccccccccccccccccccccccccccccccccccc" }
  ],
  "validity": {
    "valid": true,
    "receiptHash": "sha256:dddddddddddddddddddddddddddddddddddddddddddddddddddddddddddddddd"
  },
  "artifact": {
    "type": "derived_summary",
    "reversible": true,
    "reconstructable": true
  },
  "deterministicChecks": {
    "receiptHash": "sha256:eeeeeeeeeeeeeeeeeeeeeeeeeeeeeeeeeeeeeeeeeeeeeeeeeeeeeeeeeeeeeeee",
    "detectedTriggers": [
      { "code": "new-factual-assertion", "evidenceHash": "sha256:ffffffffffffffffffffffffffffffffffffffffffffffffffffffffffffffff" }
    ]
  },
  "reviewer": {
    "assessmentHash": "sha256:cccccccccccccccccccccccccccccccccccccccccccccccccccccccccccccccc",
    "independent": true,
    "conflictsWithDeterministicChecks": false,
    "unsupportedClaimIds": [],
    "contradictionIds": [],
    "scopeMatch": true,
    "recommendedLane": "AUTO_ADMIT_CANDIDATE"
  }
}
